[
  {
    "id": "unrated",
    "score": null,
    "label": "Not rated yet",
    "color": "#b3aaa0",
    "description": "Sponsor not investigated yet. A rating only goes up once every claim behind it is sourced."
  },
  {
    "id": "none",
    "score": 0,
    "label": "Nothing found",
    "color": "#f3ede6",
    "description": "Sponsor and owner checked; no link to serious abuses found."
  },
  {
    "id": "concern",
    "score": 1,
    "label": "Concern",
    "color": "#e6b3a8",
    "fill": "#d9a399",
    "description": "A lesser link, e.g. partly owned by a state or state fund with a poor record."
  },
  {
    "id": "serious",
    "score": 2,
    "label": "Serious",
    "color": "#e0705f",
    "fill": "#8a2a22",
    "description": "Owned by a state or state fund with documented serious abuses."
  },
  {
    "id": "severe",
    "score": 3,
    "label": "Severe",
    "color": "#ff4a3d",
    "fill": "#e3121b",
    "description": "Paid for by a state directly tied to ongoing severe abuses (e.g. armed conflict, conflict minerals)."
  }
]